{
  "command_id": "11111111-1111-4111-8111-111111111111",
  "schema_version": "0.1.0",
  "command_name": "register_pair",
  "requested_at": "2026-10-01T23:30:00Z",
  "actor_id": "operator",
  "actor_role": "OWNER_ADMIN",
  "device_id": "DEV-COUNTER01",
  "location_id": "LOC-RINK",
  "idempotency_key": "example-register-SKT-0001",
  "payload": {
    "pair": {
      "pair_id": "SKT-0001",
      "owner_org_id": "ORG-AVARACHI",
      "size_system": "US_MENS",
      "size_value": "8",
      "category": "HOCKEY",
      "brand": "Riedell",
      "home_location_id": "LOC-RINK",
      "current_location_id": "LOC-RINK",
      "custodian_org_id": "ORG-AVARACHI"
    }
  },
  "offline_created": false
}
